{
  "case": "Accept_ProfileSymbolTableAligned",
  "kind": "acceptance",
  "seed": 4186731069313083244,
  "expected_behavior": "symbol_table_aligned",
  "input": {"envelope":{"invocation_id":"urn:chatman:invocation:symtab-1","snapshot_id":"urn:chatman:snapshot:symtab-1","profile_id":"urn:chatman:profile:symtab-1","operator_id":"urn:chatman:operator:symtab-1","input_handles":{"nodes":["urn:chatman:node:a"],"events":[],"plan_steps":[]}},"receipts":[],"recorded_envelope_hash":"fc166bfd24f97f25ad9f96c4074290f8b98defc5730e2edaac26af4e3d0c834f"}
}
