{
  "case": "Falsify_GraphSnapshotMismatch",
  "kind": "falsification",
  "seed": 7384024049033094848,
  "mutation": "Reorder two quads in the stored snapshot so the replay hash diverges.",
  "expected_refusal": "GraphSnapshotMismatch",
  "input": {"envelope":{"invocation_id":"urn:chatman:invocation:replay-1","snapshot_id":"urn:chatman:snapshot:replay-1","profile_id":"urn:chatman:profile:replay-1","operator_id":"urn:chatman:operator:replay-1","input_handles":{"nodes":["urn:chatman:node:1","urn:chatman:node:2"],"events":["urn:chatman:event:1"],"plan_steps":["urn:chatman:plan-step:1"]}},"receipts":[{"subject":"urn:chatman:subject:boundary-1","digest":"a55727e5481faa3afdb44c4bc15c5d7feaabc39925c2a5ba0480fa9be37babca"}],"recorded_envelope_hash":"d42a67b3de5041b94d40ea04b1aa5d3d8750621c9425d6b25459a07601017c30"}
}
